{"$schema":"https://json-schema.org/draft/2020-12/schema","title":"Animation Pack v1","type":"object","additionalProperties":false,"required":["schema_version","pack_id","frame_rate","compatibility_tags","required_bones","actions"],"properties":{"schema_version":{"const":1},"pack_id":{"type":"string"},"frame_rate":{"type":"integer","minimum":1,"maximum":240},"compatibility_tags":{"type":"array","items":{"type":"string"},"uniqueItems":true},"required_bones":{"type":"array","items":{"type":"string"},"uniqueItems":true},"actions":{"type":"array","items":{"type":"object","additionalProperties":false,"required":["name","frame_start","frame_end","loop","root_motion","required_bones","events","poses"],"properties":{"name":{"type":"string"},"frame_start":{"type":"integer"},"frame_end":{"type":"integer"},"loop":{"type":"boolean"},"root_motion":{"enum":["none","in_place","root_bone"]},"required_bones":{"type":"array","items":{"type":"string"}},"events":{"type":"array","items":{"type":"object","required":["name","frame"],"additionalProperties":false,"properties":{"name":{"type":"string"},"frame":{"type":"integer"}}}},"poses":{"type":"array","items":{"type":"object","required":["frame","bones"],"additionalProperties":false,"properties":{"frame":{"type":"integer"},"bones":{"type":"object","additionalProperties":{"type":"array","prefixItems":[{"type":"number"},{"type":"number"},{"type":"number"}],"minItems":3,"maxItems":3}}}}}}}}}}
